{"schema_version":1,"kind":"performance","id":"a-spark-becomes-a-constellation","title":"A Spark Becomes a Constellation","dimensions":{"grid":[8,8],"top":8,"right":8},"duration_ms":43100,"acts":["Prelude - Alone","Act I - An Idea","Act II - The Search","Act III - A Friend","Act IV - The Storm","Act V - The Call","Act VI - Together","Finale - A Constellation"],"palette":[{"fallback":"accent:cyan:selected","rgb":[0,222,255]},{"fallback":"accent:cyan:selected","rgb":[29,58,245]},{"fallback":"accent:cyan:selected","rgb":[29,173,245]},{"fallback":"accent:cyan:selected","rgb":[29,245,187]},{"fallback":"accent:cyan:selected","rgb":[44,75,201]},{"fallback":"accent:cyan:selected","rgb":[44,128,201]},{"fallback":"accent:cyan:selected","rgb":[46,68,210]},{"fallback":"accent:cyan:selected","rgb":[46,78,210]},{"fallback":"accent:cyan:selected","rgb":[46,134,210]},{"fallback":"accent:cyan:selected","rgb":[48,81,219]},{"fallback":"accent:cyan:selected","rgb":[48,140,219]},{"fallback":"accent:cyan:selected","rgb":[48,198,219]},{"fallback":"accent:cyan:selected","rgb":[50,84,227]},{"fallback":"accent:cyan:selected","rgb":[50,145,227]},{"fallback":"accent:cyan:selected","rgb":[50,206,227]},{"fallback":"accent:cyan:selected","rgb":[52,88,236]},{"fallback":"accent:cyan:selected","rgb":[52,151,236]},{"fallback":"accent:cyan:selected","rgb":[52,214,236]},{"fallback":"accent:cyan:selected","rgb":[54,91,245]},{"fallback":"accent:cyan:selected","rgb":[54,143,245]},{"fallback":"accent:cyan:selected","rgb":[54,156,245]},{"fallback":"accent:cyan:selected","rgb":[55,110,250]},{"fallback":"accent:cyan:selected","rgb":[55,180,250]},{"fallback":"accent:cyan:selected","rgb":[55,250,250]},{"fallback":"accent:cyan:selected","rgb":[65,42,192]},{"fallback":"accent:cyan:selected","rgb":[67,54,245]},{"fallback":"accent:cyan:selected","rgb":[68,44,201]},{"fallback":"accent:cyan:selected","rgb":[70,46,210]},{"fallback":"accent:cyan:selected","rgb":[76,50,227]},{"fallback":"accent:cyan:selected","rgb":[78,134,245]},{"fallback":"accent:cyan:selected","rgb":[78,223,245]},{"fallback":"accent:cyan:selected","rgb":[79,52,236]},{"fallback":"accent:cyan:selected","rgb":[94,48,219]},{"fallback":"accent:cyan:selected","rgb":[123,78,245]},{"fallback":"accent:cyan:selected","rgb":[130,29,245]},{"fallback":"accent:cyan:selected","rgb":[168,50,227]},{"fallback":"accent:cyan:selected","rgb":[181,54,245]},{"fallback":"accent:cyan:selected","rgb":[221,49,193]},{"fallback":"accent:cyan:selected","rgb":[223,78,245]},{"fallback":"accent:cyan:selected","rgb":[236,52,224]},{"fallback":"accent:cyan:selected","rgb":[245,29,101]},{"fallback":"accent:cyan:selected","rgb":[245,29,230]},{"fallback":"accent:cyan:selected","rgb":[245,54,79]},{"fallback":"accent:cyan:selected","rgb":[245,54,194]},{"fallback":"accent:cyan:selected","rgb":[245,78,78]},{"fallback":"accent:cyan:selected","rgb":[245,78,167]},{"fallback":"accent:cyan:unselected","rgb":[0,43,55]},{"fallback":"accent:cyan:unselected","rgb":[12,43,97]},{"fallback":"accent:cyan:unselected","rgb":[12,97,49]},{"fallback":"accent:cyan:unselected","rgb":[13,22,60]},{"fallback":"accent:cyan:unselected","rgb":[14,23,63]},{"fallback":"accent:cyan:unselected","rgb":[14,24,66]},{"fallback":"accent:cyan:unselected","rgb":[14,40,63]},{"fallback":"accent:cyan:unselected","rgb":[14,42,66]},{"fallback":"accent:cyan:unselected","rgb":[14,59,66]},{"fallback":"accent:cyan:unselected","rgb":[14,59,117]},{"fallback":"accent:cyan:unselected","rgb":[14,114,117]},{"fallback":"accent:cyan:unselected","rgb":[15,25,68]},{"fallback":"accent:cyan:unselected","rgb":[15,44,68]},{"fallback":"accent:cyan:unselected","rgb":[15,62,68]},{"fallback":"accent:cyan:unselected","rgb":[16,26,71]},{"fallback":"accent:cyan:unselected","rgb":[16,27,74]},{"fallback":"accent:cyan:unselected","rgb":[16,33,75]},{"fallback":"accent:cyan:unselected","rgb":[16,45,71]},{"fallback":"accent:cyan:unselected","rgb":[16,47,74]},{"fallback":"accent:cyan:unselected","rgb":[16,54,75]},{"fallback":"accent:cyan:unselected","rgb":[16,64,71]},{"fallback":"accent:cyan:unselected","rgb":[16,75,75]},{"fallback":"accent:cyan:unselected","rgb":[17,31,76]},{"fallback":"accent:cyan:unselected","rgb":[20,9,76]},{"fallback":"accent:cyan:unselected","rgb":[20,13,58]},{"fallback":"accent:cyan:unselected","rgb":[20,13,60]},{"fallback":"accent:cyan:unselected","rgb":[21,14,63]},{"fallback":"accent:cyan:unselected","rgb":[21,39,97]},{"fallback":"accent:cyan:unselected","rgb":[21,79,97]},{"fallback":"accent:cyan:unselected","rgb":[23,15,68]},{"fallback":"accent:cyan:unselected","rgb":[24,16,71]},{"fallback":"accent:cyan:unselected","rgb":[24,57,76]},{"fallback":"accent:cyan:unselected","rgb":[26,12,97]},{"fallback":"accent:cyan:unselected","rgb":[31,33,97]},{"fallback":"accent:cyan:unselected","rgb":[31,97,86]},{"fallback":"accent:cyan:unselected","rgb":[38,40,117]},{"fallback":"accent:cyan:unselected","rgb":[38,83,117]},{"fallback":"accent:cyan:unselected","rgb":[49,21,97]},{"fallback":"accent:cyan:unselected","rgb":[54,24,76]},{"fallback":"accent:cyan:unselected","rgb":[59,26,117]},{"fallback":"accent:cyan:unselected","rgb":[66,15,58]},{"fallback":"accent:cyan:unselected","rgb":[75,17,76]},{"fallback":"accent:cyan:unselected","rgb":[76,9,52]},{"fallback":"accent:cyan:unselected","rgb":[77,12,97]},{"fallback":"accent:cyan:unselected","rgb":[93,14,117]},{"fallback":"accent:cyan:unselected","rgb":[97,12,14]},{"fallback":"accent:cyan:unselected","rgb":[97,21,54]},{"fallback":"accent:cyan:unselected","rgb":[97,31,86]},{"fallback":"accent:lime:selected","rgb":[52,202,235]},{"fallback":"accent:lime:selected","rgb":[54,54,245]},{"fallback":"accent:lime:selected","rgb":[99,52,235]},{"fallback":"accent:lime:selected","rgb":[101,29,245]},{"fallback":"accent:lime:selected","rgb":[107,42,192]},{"fallback":"accent:lime:selected","rgb":[116,29,245]},{"fallback":"accent:lime:selected","rgb":[156,54,245]},{"fallback":"accent:lime:selected","rgb":[164,255,38]},{"fallback":"accent:lime:selected","rgb":[175,44,201]},{"fallback":"accent:lime:selected","rgb":[175,245,54]},{"fallback":"accent:lime:selected","rgb":[187,245,29]},{"fallback":"accent:lime:selected","rgb":[200,78,245]},{"fallback":"accent:lime:selected","rgb":[206,45,152]},{"fallback":"accent:lime:selected","rgb":[210,46,172]},{"fallback":"accent:lime:selected","rgb":[219,48,111]},{"fallback":"accent:lime:selected","rgb":[227,150,50]},{"fallback":"accent:lime:selected","rgb":[230,29,245]},{"fallback":"accent:lime:selected","rgb":[236,230,52]},{"fallback":"accent:lime:selected","rgb":[245,29,130]},{"fallback":"accent:lime:selected","rgb":[245,54,105]},{"fallback":"accent:lime:selected","rgb":[245,54,219]},{"fallback":"accent:lime:selected","rgb":[245,58,29]},{"fallback":"accent:lime:selected","rgb":[245,78,89]},{"fallback":"accent:lime:selected","rgb":[245,78,189]},{"fallback":"accent:lime:selected","rgb":[245,118,54]},{"fallback":"accent:lime:selected","rgb":[245,167,78]},{"fallback":"accent:lime:selected","rgb":[245,187,29]},{"fallback":"accent:lime:selected","rgb":[245,219,54]},{"fallback":"accent:lime:selected","rgb":[245,232,54]},{"fallback":"accent:lime:unselected","rgb":[16,61,70]},{"fallback":"accent:lime:unselected","rgb":[30,16,70]},{"fallback":"accent:lime:unselected","rgb":[34,55,6]},{"fallback":"accent:lime:unselected","rgb":[35,17,76]},{"fallback":"accent:lime:unselected","rgb":[38,76,9]},{"fallback":"accent:lime:unselected","rgb":[47,24,76]},{"fallback":"accent:lime:unselected","rgb":[62,14,46]},{"fallback":"accent:lime:unselected","rgb":[66,12,97]},{"fallback":"accent:lime:unselected","rgb":[67,17,76]},{"fallback":"accent:lime:unselected","rgb":[67,76,17]},{"fallback":"accent:lime:unselected","rgb":[76,9,20]},{"fallback":"accent:lime:unselected","rgb":[76,9,61]},{"fallback":"accent:lime:unselected","rgb":[76,19,17]},{"fallback":"accent:lime:unselected","rgb":[76,24,44]},{"fallback":"accent:lime:unselected","rgb":[76,37,24]},{"fallback":"accent:lime:unselected","rgb":[76,55,17]},{"fallback":"accent:lime:unselected","rgb":[76,64,24]},{"fallback":"accent:lime:unselected","rgb":[97,12,26]},{"fallback":"accent:lime:unselected","rgb":[97,21,64]},{"fallback":"accent:lime:unselected","rgb":[97,31,95]},{"fallback":"accent:lime:unselected","rgb":[97,46,31]},{"fallback":"accent:lime:unselected","rgb":[97,69,21]},{"fallback":"accent:lime:unselected","rgb":[117,14,93]},{"fallback":"accent:lime:unselected","rgb":[117,29,26]},{"fallback":"accent:lime:unselected","rgb":[117,38,67]},{"fallback":"accent:lime:unselected","rgb":[117,59,14]},{"fallback":"accent:lime:unselected","rgb":[117,104,38]},{"fallback":"accent:lime:unselected","rgb":[117,114,14]},{"fallback":"accent:magenta:selected","rgb":[42,80,192]},{"fallback":"accent:magenta:selected","rgb":[53,226,243]},{"fallback":"accent:magenta:selected","rgb":[68,44,201]},{"fallback":"accent:magenta:selected","rgb":[86,53,243]},{"fallback":"accent:magenta:selected","rgb":[116,42,192]},{"fallback":"accent:magenta:selected","rgb":[121,44,201]},{"fallback":"accent:magenta:selected","rgb":[127,46,210]},{"fallback":"accent:magenta:selected","rgb":[136,46,210]},{"fallback":"accent:magenta:selected","rgb":[137,50,227]},{"fallback":"accent:magenta:selected","rgb":[142,52,236]},{"fallback":"accent:magenta:selected","rgb":[175,44,201]},{"fallback":"accent:magenta:selected","rgb":[183,46,210]},{"fallback":"accent:magenta:selected","rgb":[190,48,219]},{"fallback":"accent:magenta:selected","rgb":[198,50,227]},{"fallback":"accent:magenta:selected","rgb":[206,52,236]},{"fallback":"accent:magenta:selected","rgb":[210,46,181]},{"fallback":"accent:magenta:selected","rgb":[210,48,219]},{"fallback":"accent:magenta:selected","rgb":[213,47,172]},{"fallback":"accent:magenta:selected","rgb":[213,54,245]},{"fallback":"accent:magenta:selected","rgb":[219,48,130]},{"fallback":"accent:magenta:selected","rgb":[219,48,188]},{"fallback":"accent:magenta:selected","rgb":[227,50,135]},{"fallback":"accent:magenta:selected","rgb":[227,50,165]},{"fa